{
  "schema": "flowmemory.agent_bonds_go_no_go_attestation.v1",
  "approved": false,
  "decisionOwner": "PENDING_OWNER",
  "decisionPath": "docs/DECISIONS/AGENT_BONDS_CAPPED_PILOT_GO_NO_GO.md",
  "docPath": "docs/OPERATIONS/AGENT_BONDS_PUBLIC_LAUNCH_APPROVAL.md",
  "approvedAt": "PENDING",
  "notes": "Replace after final owner go/no-go decision is recorded."
}
